"ordre","reference","nom","code","description","is_editable_only_by_formateur","sys_color_reference"
"1","TODO","À faire","TODO","Le chapitre est planifié mais pas encore commencé par l'apprenant.","","secondary"
"2","IN_PROGRESS","En cours","IN_PROGRESS","Le chapitre est en cours d'exécution par l'apprenant.","","info"
"3","PAUSED","En pause","PAUSED","Le chapitre est temporairement mis en pause par l'apprenant ou le formateur.","","danger"
"4","READY_FOR_LIVE_CODING","Prêt pour Live Coding","READY_FOR_LIVE_CODING","Le chapitre est terminé par l'apprenant et prêt à être testé en live coding.","","primary"
"5","IN_LIVE_CODING","En Live Coding","IN_LIVE_CODING","Le chapitre est en phase de validation via une séance de live coding.","","indigo"
"6","TO_APPROVE","À valider","TO_APPROVE","Le chapitre est en attente de validation finale par le formateur (après live coding).","","warning"
"7","DONE","Terminé","DONE","Le chapitre a été validé définitivement par le formateur.","1","success"
"8","BLOCKED","Bloqué","BLOCKED","Le chapitre est bloqué (problèmes techniques ou pédagogiques).","1","danger"