nom,description
Langages de développement,"Langages utilisés pour le développement frontend et backend, y compris HTML, CSS, JavaScript, TypeScript, PHP, Python, et Node.js."
Frameworks et bibliothèques,"Frameworks et bibliothèques utilisés pour simplifier et accélérer le développement, comme React, Bootstrap, Vue.js, Laravel, Symfony, et Django."
Bases de données et API,"Technologies pour organiser les données et gérer les interactions entre systèmes, comme MySQL, MongoDB, REST, et GraphQL."
Outils DevOps et gestion de version,"Technologies pour gérer les versions de code et automatiser les workflows, comme Git, Docker, Jenkins, et Kubernetes."
Hébergement et cloud,"Services pour héberger, déployer et gérer des applications, comme AWS, Azure, Google Cloud, et Netlify."
Systèmes de gestion de contenu et outils de développement,"Plateformes CMS comme WordPress et outils comme VS Code, WebStorm, et PhpStorm pour coder efficacement."
Tests et sécurité,"Technologies pour tester et sécuriser les applications, comme Jest, Selenium, HTTPS, et OAuth."
Conception et expérience utilisateur,"Outils pour créer des interfaces utilisateur et améliorer l'expérience, comme Figma, Adobe XD, et Sketch."