ordre,titre,code,thematique,filiere_reference,objectifs_pedagogique,titre_prototype,description_prototype,contraintes_prototype,titre_projet,description_projet,contraintes_projet,remarques,date_debut,date_fin,jour_feries_vacances,reference,annee_formation_reference
1,SAS & Logique + Découverte pédagogique,S1,SAS & Logique + Découverte pédagogique,DWB,"Comprendre la pédagogie active, initier la logique JS (variables, conditions, boucles), découvrir Git &amp; GitHub, et réaliser un premier mini-projet en console.&nbsp;",Décompteur de compétences Solicode,"Script JS parcourant un tableau de compétences et comptant les occurrences d'un code choisi, en console.","JavaScript en console uniquement, dépôt GitHub.",Jeu de mémorisation du programme Solicode,Jeu éducatif en JS console pour mémoriser les 8 compétences (C1 à C8).,"Code uniquement JS, score, validation des réponses.",Session préparatoire.,2025-09-20,2025-10-03,<p><br></p>,DWB-S1,2024-2025
2,HTML – Fondamentaux,S2,HTML – Fondamentaux,DWB,"Structurer une page HTML, balises courantes, formulaire accessible, mini-site 3 pages.",Page profil Solicode,"Page HTML unique avec profil d’apprenant, balises sémantiques et formulaire accessible.","HTML sémantique uniquement, sans CSS/JS.",Mini-site HTML – Présentation personnelle,"Mini-site statique (3 pages : accueil, CV, contact).","Navigation interne cohérente, code HTML valide.",Première brique du projet fil rouge (blog).,2025-10-06,2025-10-17,Aucun,DWB-S2,2024-2025
3,CSS – Mise en forme & Layout,S3,CSS – Mise en forme & Layout,DWB,"Bases du CSS, propriétés fondamentales, Flexbox et Grid, stylisation du blog (projet fil rouge).",Maquette stylisée d’une page d’accueil,"Ajout de styles CSS (texte, couleurs, alignement) sur la page HTML produite en S02.",Utilisation de Flexbox et Grid uniquement.,Blog statique – version stylisée,Version stylisée des 3 pages HTML de S02.,"CSS personnalisé, pas de bibliothèque externe.",,2025-10-20,2025-10-31,Aucun,DWB-S3,2024-2025
4,JavaScript – Premiers pas,S4,JavaScript – Premiers pas,DWB,"Fondamentaux JS : variables, fonctions, conditions, boucles, scripts console.",Simulateur de tarifs Solicode,Programme JS demandant un type de formation et affichant un tarif estimé.,"Conditions if/else/switch, console.log().",Jeu console – Quiz logique JavaScript,Jeu console interactif posant 5 questions logiques avec score final.,Projet JS console sans DOM.,Prépare la manipulation du DOM (S05).,2025-11-03,2025-11-14,6 novembre – Marche Verte,DWB-S4,2024-2025
5,JavaScript – DOM & Événements,S5,JavaScript – DOM & Événements,DWB,"Sélectionner/modifier des éléments HTML, comprendre le DOM, gérer les événements, développer une interface interactive.",Check-list interactive,Liste HTML avec cases à cocher et compteur dynamique.,"HTML + JS natif, pas de base de données.",To-do list locale – Version simplifiée,Application locale de gestion de tâches avec ajout/suppression/cochage.,Option localStorage.,Introduction à la programmation événementielle.,2025-11-17,2025-11-28,18 novembre – Fête de l’Indépendance,DWB-S5,2024-2025
6,JavaScript – API & Données,S6,JavaScript – API & Données,DWB,"Interagir avec des APIs via fetch(), traiter des données JSON et les afficher dynamiquement.",Application météo simple,Page HTML interrogeant l’API météo OpenWeatherMap et affichant les données.,fetch() et affichage dynamique dans le DOM.,Catalogue de produits via API,Application front récupérant et affichant une liste de produits avec filtrage.,"Données JSON, filtrage ou recherche bonus.",Prépare l'intégration de données réelles dans les projets.,2025-12-01,2025-12-12,Aucun,DWB-S6,2024-2025
7,UX/UI & Maquettage,S7,UX/UI & Maquettage,DWB,"Principes UX et UI, création de maquettes avec Figma, refonte visuelle d’un blog.",Maquette Figma – Blog Solicode,Maquette statique d’une page d’accueil de blog avec hiérarchie visuelle.,"Pas de code, livrable visuel uniquement.",Audit UX & Refonte UI,Analyse UX et création d’une nouvelle maquette UI.,Export PDF ou lien Figma.,Amorce une réflexion critique sur l’ergonomie et le design.,2025-12-15,2025-12-26,Vacances du 27 décembre au 5 janvier,DWB-S7,2024-2025
8,Git & Collaboration,S8,Git & Collaboration,DWB,"Fonctionnement de Git, utilisation de GitHub, workflow collaboratif en binôme.",Workflow Git en binôme – Mini-projet partagé,"Dépôt GitHub, branches, pull/push, résolution de conflits simples.","GitHub, branches, commits clairs.",Organisation de projet en équipe,Mini-projet HTML/JS collaboratif avec workflow Git structuré.,Issues ou fichier TODO pour organisation.,Compétences transversales réutilisables dans tous les projets.,2026-01-06,2026-01-17,Aucun,DWB-S8,2024-2025
9,Base de données – Modélisation & SQL,S9,Base de données – Modélisation & SQL,DWB,"Principes de modélisation, création de bases SQL, premières requêtes SELECT.",Modèle + Script SQL de base,"Production d’un MCD, MLD et script SQL pour un blog simple.","Création de tables, clés primaires/étrangères.",Base de données – Blog Solicode,"Base SQL complète pour un blog (tables, contraintes, script d’initialisation).",Script structuré et documenté.,Pose les bases du stockage de données structuré.,2026-01-20,2026-01-31,Vacances du 1er au 8 février,DWB-S9,2024-2025
10,SQL – Requêtes & manipulation des données,S10,SQL – Requêtes & manipulation des données,DWB,"Requêtes SELECT, WHERE, ORDER BY, jointures, INSERT, UPDATE, DELETE.",Explorateur de données SQL,Écriture de requêtes SQL répondant à des questions métiers.,Fichier .sql et captures de résultats.,Dashboard de lecture SQL (simulation),Script SQL ou document Markdown simulant des rapports et manipulations.,Documentation claire des requêtes.,Exploitation des bases créées en S09.,2026-02-09,2026-02-20,Aucun,DWB-S10,2024-2025
11,PHP – Syntaxe & logique,S11,Découverte de PHP procédural,DWB,"Découvrir la syntaxe PHP, variables, fonctions, tableaux et écrire des scripts procéduraux.",Simulateur d’opérations PHP,Formulaire HTML (2 nombres + opération) envoyé en POST et calculé par PHP.,"Validation des données, conditions et fonctions.",Mini-app logique – PHP procédural,"Petite application PHP (quiz, calculateur) sans base de données.","Pas de POO, 100% local, fichiers PHP + README.",Transition front-end vers back-end.,2026-02-23,2026-03-06,Aucun,DWB-S11,2024-2025
12,PHP – Formulaires & navigation,S12,Interaction utilisateur via formulaires et sessions,DWB,"Apprendre à traiter des formulaires, utiliser GET/POST, gérer sessions/cookies et navigation dynamique.",Formulaire de contact avec traitement PHP,"Page PHP validant un formulaire (nom, email, message), avec affichage conditionnel.","Pas de base de données, POST uniquement.",Espace utilisateur simplifié (sans base de données),"Mini-app avec login, sessions, pseudo en mémoire, déconnexion.","Code PHP procédural, option cookies.",Bases de la gestion d’état côté serveur.,2026-03-09,2026-03-20,Vacances du 21 au 28 mars,DWB-S12,2024-2025
13,POO & Accès aux données avec PHP,S13,Structuration du code et interaction avec BDD,DWB,"Introduire la POO en PHP, utiliser PDO et réaliser un CRUD complet.",CRUD orienté objet – Articles de blog,Mini-app listant et ajoutant des articles via classe Article et PDO.,"Organisation en plusieurs fichiers (Article.php, index.php, create.php).",Manager d’articles – Back-office simplifié,"CRUD complet : ajout, modification, suppression d’articles.","Requêtes préparées, code sécurisé.",Approche orientée objet avec base MySQL.,2026-03-30,2026-04-10,Aucun,DWB-S13,2024-2025
14,CMS – WordPress,S14,Créer un site web sans coder avec WordPress,DWB,"Découvrir WordPress, installer et configurer un site, personnaliser thème et plugins.",Site WordPress minimal – “Portfolio apprenant”,"Installation locale de WordPress et création de 3 pages (Accueil, À propos, Contact).","Navigation, personnalisation thème par défaut.",Blog WordPress personnalisé,"Blog complet avec 3 articles, catégories, formulaire de contact.","Ajout de plugins utiles, contenu réaliste.",Utilisation d’un CMS professionnel.,2026-04-13,2026-04-24,Aucun,DWB-S14,2024-2025
15,Blog – Maquette & Structure HTML,S15,Préparer le blog fil rouge – Structure HTML & design responsive,DWB,"Transformer une maquette en code HTML, structurer pages (accueil, article, contact) et initier le responsive.",Structure HTML de la page d’accueil du blog,"Structure HTML complète (header, articles récents, footer).","Balises sémantiques, classes claires.",Structure HTML/CSS complète du blog,"Développement des pages index.html, article.html, contact.html avec design responsive.","HTML/CSS natif, Flexbox ou Grid.",Lancement du projet fil rouge.,2026-04-27,2026-05-08,Vacances du 9 au 16 mai,DWB-S15,2024-2025
16,Blog – Intégration front/back,S16,Relier formulaires et base de données – blog dynamique,DWB,"Connecter formulaires à MySQL via PHP, affichage dynamique et sécurisation des requêtes.",Formulaire de création d’article connecté à MySQL,Formulaire PHP insérant un article dans la table posts via PDO.,Validation minimale et confirmation.,Blog dynamique PHP/MySQL – version 1,Blog statique (S15) évolué en version dynamique avec articles en base.,"PDO, requêtes préparées, navigation fluide.",Pont entre front statique et back dynamique.,2026-05-18,2026-05-29,Aucun,DWB-S16,2024-2025
17,Projet final – Préparation,S17,Planification du blog final et consolidation des compétences,DWB,"Préparer le projet final : planification, cahier des charges, base SQL initiale, maquette.",Planification fonctionnelle du projet de blog,"Fiche de spécifications détaillant fonctionnalités, arborescence, schéma BDD.",Document .md ou .pdf avec wireframe.,Maquette interactive & plan technique du blog final,"Maquette complète, plan technique, routes et scripts à prévoir.",Prêt pour implémentation en S18.,Session de préparation du projet final.,2026-06-01,2026-06-12,Aucun,DWB-S17,2024-2025
18,Projet final – Soutenance,S18,Finalisation et présentation du projet de blog,DWB,"Finaliser le blog complet, le documenter et le présenter en soutenance.",sans,Pas de prototype (projet finalisé directement).,,Blog final – Version présentée,"Projet complet (CRUD articles, pages dynamiques, responsive, base SQL).","README clair, lien GitHub, présentation orale 10-15 min.",Clôture du parcours Solicode Web.,2026-06-15,2026-06-26,Aucun,DWB-S18,2024-2025
1,Rappel PHP/POO + Git (Laravel),S01,Bases PHP modernes & dépôt initial,DMB,Maîtriser PHP moderne et init Git; produire un dataset propre,CLI de normalisation,Script qui lit JSON/CSV et génère articles.seed.json,≤40min; PHP≥8.2; STDIN/STDOUT; erreurs gérées; 1 commit clair,Pipeline de seed,Chaîner composer run seed: build→validate→save pour dataset reproductible du blog,PSR-4; scripts composer; README exécution; échantillons versionnés,Dataset servira aux seeds Laravel (S03+) et aux listes,2025-10-06,2025-10-17,Aucun,DMB-S01,2024-2025
2,Onboarding Android/Compose (Mobile),S02,"Projet Compose qui build, préviews OK",DMB,Installer Android Studio; créer une app Compose qui build,Hello+Counter (Compose),Écran hello + compteur avec rememberSaveable et 2 @Preview,≤40min; APK debug; package stable; a11y basique,Skeleton M3 + Navigation,"Appliquer Material3, AppScaffold et nav min. pour l’app mobile du fil rouge",APK livré; structure ui/data/core; 2 écrans; README install,Seule session 100% Mobile au début pour démarrer C5,2025-10-20,2025-10-31,Aucun,DMB-S02,2024-2025
3,Install Laravel + Composer + seed CSV (Laravel),S03,Projet qui tourne + import CSV idempotent,DMB,Initialiser Laravel relié DB; importer CSV idempotent,Site OK + /ping,Projet Laravel qui tourne avec route /ping et layout Blade,≤40min; .env correct; MySQL OK; artisan serve OK,Seed CSV outillé,Import contrôlé via staging + seeders propres pour alimenter le blog,Idempotence; make seed-csv; .env.example; doc de lancement,Base technique du blog utilisée dans S04–S06,2025-11-03,2025-11-14,Marche Verte (2025-11-06),DMB-S03,2024-2025
4,Schéma relationnel + seeders/factories (Laravel),S04,Tables PK/FK + jeux de données réalistes,DMB,Concevoir schéma relationnel; produire données réalistes,Migrations & factories,"Tables articles/tags/pivot + factories liées, migrate --seed",≤40min; PK/FK; contraintes; faker déterministe,DatabaseSeeder déterministe,Orchestration de seeds reproductibles (user→articles→tags),Unicité slug; data cohérente; export JSON d’échantillon,Prépare CRUD et API (S05–S06),2025-11-17,2025-11-28,Fête de l’Indépendance (2025-11-18),DMB-S04,2024-2025
5,CRUD + relations n-n (Laravel),S05,"Back-office Article minimal, cycle issue→PR",DMB,Réaliser un CRUD Article; gérer n-n avec Tags,CRUD Article rapide,Routes resource + vues index/create/edit/show + validation,≤40min; pagination; flash; usabilité minimale,Articles & Tags (n-n),Back-office complet avec sync() des tags et pagination,Issue→PR; formulaires valides; README admin; DoD,Donne une base d’admin exploitable pour la suite,2025-12-01,2025-12-12,Aucun,DMB-S05,2024-2025
6,API REST v1 (lecture) (Laravel),S06,"/api/articles paginé/filtré/trié, JSON homogène, stratégie de branches",DMB,Exposer une API REST lisible et paginée,/api/articles normalisé,apiResource + ArticleResource/Collection + filtres/tri/pagination,≤40min; whitelist de tri/filtre; JSON meta/links homogène,Contrat API v1,Doc Postman/Insomnia + exemples curl; versionnage v1,Schéma stable; tests succès/erreurs; README contrat,Contrat consommé par Mobile (S09),2025-12-15,2025-12-26,Vacances d’automne (2025-12-21→2025-12-28),DMB-S06,2024-2025
7,UI & Maquettes en HTML/CSS (Laravel/Web),S07,"Carte écrans, flux, wireframes validés par maquette HTML/CSS",DMB,Valider UI par maquettes HTML/CSS réutilisables,Styleguide + pages statiques,styleguide.html + css/tokens.css; pages Liste/Détail responsive,≤40min; HTML sémantique; CSS tokens; responsive simple,Kit UI prêt à brancher,Composants Card/Button/Field et conventions pour intégration API,Noms classes/IDs stables; notes handoff; accessibilité de base,Base visuelle du blog public,2025-12-29,2026-01-09,Nouvel An Grégorien (2026-01-01),DMB-S07,2024-2025
8,Eloquent avancé : scopes/whereHas/N+1 (Laravel),S08,"Listes rapides, filtrage maintenable, sync Git propre (rebase)",DMB,Optimiser requêtes Eloquent; éviter N+1; filtrer proprement,Index sans N+1,search()/filter() + with/withCount + whereHas; index rapide,≤40min; profiling simple; pas de régression fonctionnelle,Liste tri/filtre + profilage,Index public triable (activité/tag/auteur) avec captures EXPLAIN,Index utile; docs des requêtes; mesures incluses,Prépare perfs et tri côté API/UI,2026-01-12,2026-01-23,Nouvel An Amazigh (2026-01-14),DMB-S08,2024-2025
9,Consommer l’API : GET + VM/UiState (Mobile),S09,Liste d’articles avec états loading/empty/error/success,DMB,Consommer l’API v1 en Mobile; gérer états UI,Liste d’articles (GET),Retrofit + Repository + VM StateFlow; écran Liste avec Retry,≤40min; previews succès/vide/erreur; BASE_URL via BuildConfig,StateContainer réutilisable,Factoriser Loading/Empty/Error et réutiliser Repository,APK debug; mapping DTO→UI; README usage,Premier écran Mobile branché au blog,2026-01-26,2026-02-06,Vacances de mi-année (2026-01-25→2026-02-01),DMB-S09,2024-2025
10,Mi-année PFF : analyse besoin + sprint 1 (Laravel),S10,"Persona, problème & métriques, stories/backlog + planning de sprint",DMB,Cadrer le MVP; planifier sprint; définir métriques,Cadre MVP testable,Persona + problem statement + 2–3 métriques SMART + 3 stories GWT,≤40min; documents courts; IDs stables; traçabilité,Backlog MVP + traçabilité,Matrice Stories↔UC↔Écrans; PB/SB; Sprint Goal et board Kanban,WIP défini; issues créées; DoR/DoD affichés,Base produit pour livraisons des sprints suivants,2026-02-09,2026-02-20,Aucun,DMB-S10,2024-2025
11,Sécurité : middlewares + policies (Laravel),S11,"Throttle/CORS, auth admin, authorizations Article",DMB,Sécuriser API/back-office; appliquer policies,API protégée,RateLimiter + CORS + pages d’erreurs JSON (401/403/429),≤40min; profils throttle; CORS minimal; preuves par curl,Policies Article,authorizeResource + @can pour limiter édition/suppression,Tests d’accès; rôles admin/auteur; docs cas d’accès,Sécurité par ressource alignée avec le domaine,2026-02-23,2026-03-06,Aucun,DMB-S11,2024-2025
12,Écritures sûres : transactions + index/EXPLAIN + CSV (Laravel),S12,Rating transactionnel + perfs validées + sauvegarde/restore/CSV,DMB,Fiabiliser écritures; valider perfs; gérer CSV,Rating transactionnel,POST/PATCH note avec rollback et index composite validé via EXPLAIN,≤40min; transactions; erreurs gérées; plan index,Service + backup/CSV,Service rating robuste + procédure export/import CSV/staging,Retry deadlock; sauvegarde/restore; journal perfs,Prépare résilience et transfert de données,2026-03-09,2026-03-20,Vacances de printemps (2026-03-15→2026-03-22),DMB-S12,2024-2025
13,Écritures Mobile : optimiste + Kotlin essentials (Mobile),S13,Add/toggle/delete/undo + gestion des erreurs réseau,DMB,Écrire en Mobile en optimiste; gérer erreurs réseau,Mise à jour optimiste,add/toggle/delete avec Snackbar Undo et bannière offline,≤40min; rollback si échec; immutabilité UiState,Résilience réseau intégrée,Outcome/backoff; mapping NetError→messages; APK debug,Tests manuels coupures; logs d’échec; README,Améliore UX Mobile sans bloquer l’UI,2026-03-23,2026-04-03,Aïd al-Fitr (date à confirmer),DMB-S13,2024-2025
14,Déploiement Web : Apache + TLS/HTTPS + vhosts (Laravel/Ops),S14,"Servir le blog en HTTPS durci (Let’s Encrypt, HSTS)",DMB,Déployer le blog via Apache+PHP-FPM; activer HTTPS,Vhost HTTP + tests santé,"Vhost propre, PHP-FPM relié, logs dédiés, tests apachectl/httpd -S/-t",≤40min; accès OK; healthcheck; logs par vhost,HTTPS + HSTS,Certbot/Let’s Encrypt + redirection HTTPS + durcissement de base,HSTS; permissions uploads; rewrite front controller,Première mise en ligne sécurisée,2026-04-06,2026-04-17,Aïd al-Fitr (date à confirmer),DMB-S14,2024-2025
15,Tests & Qualité + PR/Review + logs (Laravel),S15,"Socle de tests, PR/review, logs/rotation",DMB,Mettre en place tests et qualité; journaliser,Tests verts + logs,1 test Unit + 1 Feature JSON; .env.testing; logrotate en place,≤40min; suite qui passe; logs vérifiables,PR qualité + GoAccess,PR complète relue; centralisation logs (stack+audit) + GoAccess,Scripts test/lint; checklist revue; captures métriques,Qualité outillée et visible en équipe,2026-04-20,2026-05-01,Fête du Travail (2026-05-01),DMB-S15,2024-2025
16,"Intégration blog complet (public+admin, 3 rôles) + tests avancés (Laravel)",S16,Finaliser périmètre Web + tests médias/mocks,DMB,Finaliser périmètre Web; tester médias/mocks,Finitions & tests ciblés,Solder petites features + tests fakes/storage/mock; conflit Git résolu,≤40min; sélection courte; un conflit simulé,Blog final (public/admin),Public (liste/détail/tri/filtre) + admin (CRUD+policies) + médias testés,PR mergée; couverture tests clé; doc mise à jour,Web prêt pour démo fin d’année,2026-05-04,2026-05-15,Vacances de mai (2026-05-03→2026-05-10),DMB-S16,2024-2025
17,Traçage bout-à-bout + réseau/ops (Laravel/Ops),S17,Diagnostiquer client→Apache→PHP→DB + comptes/privilèges DB,DMB,Tracer requêtes bout-à-bout; durcir accès DB,Traces & Request-ID,Corréler curl -w/DevTools avec logs Apache/PHP/DB; vérifier privilèges,≤40min; Request-ID; commandes simples; preuves conservées,Runbook & rôles MySQL,Runbook diag pas-à-pas; création rôles/comptes moindre privilège,Procédures claires; SHOW GRANTS; checklist,Amène une observabilité et une opé standard,2026-05-18,2026-05-29,Aucun,DMB-S17,2024-2025
18,Finalisation Mobile + livraison (Mobile),S18,Nav finale + APK RC + soutenance,DMB,Finaliser Mobile et livrer; préparer soutenance,APK RC + QA,Navigation finale figée; checklist QA passée; APK RC prêt,≤40min; 2–3 écrans; corrections critiques,Livraison & clôture,README livraison + vidéo ≤60s + changelog; PR finale/tag release,Artefacts disponibles; preuves capturées; check final,Clôture fil rouge et préparation soutenance,2026-06-01,2026-06-12,Aïd al-Adha / 1er Muharram (dates à confirmer),DMB-S18,2024-2025